{
  "snapshot_type": "aof-learning-loop",
  "snapshot_format_version": 1,
  "organization_ref": ".aof/organization.json",
  "generated_at": "2026-06-15T14:47:27.305Z",
  "latest_outcome": {
    "source_session_id": "SESS-MQFBKXU8-0CLSSY",
    "report_id": "OUT-MQFBRKHE-M884LH",
    "result": "failure",
    "observed_at": "2026-06-15T14:45:05.508Z",
    "note": "Operator rejected the internally green path after Guardian veto; outcome claim must reopen instead of remaining green.",
    "signal_ref": "ESC-MQFBKXUD-52VR7W"
  },
  "latest_self_audit": null,
  "current_next_value_slice": {
    "content": "Operator rejected the internally green path after Guardian veto; outcome claim must reopen instead of remaining green.",
    "updated_at": "2026-06-15T14:45:05.524Z",
    "declared_complete_at": "2026-06-15T14:45:05.524Z",
    "source_session_id": "SESS-MQFBKXU8-0CLSSY",
    "source_decision_record_id": null
  },
  "improvement_proposal": {
    "proposal_basis": "next-value-slice",
    "proposed_focus": "Operator rejected the internally green path after Guardian veto; outcome claim must reopen instead of remaining green.",
    "related_task_ids": [],
    "open_task_count": 0
  },
  "learning_state": {
    "has_outcome_evidence": true,
    "has_self_audit": false,
    "has_next_value_slice": true,
    "loop_state": "improving"
  },
  "observations": [
    "No active framework self-audit is present yet.",
    "Current next value slice: Operator rejected the internally green path after Guardian veto; outcome claim must reopen instead of remaining green.",
    "Latest outcome result: failure",
    "Skipped unreadable session artifacts: 1"
  ]
}
