{
  "snapshot_type": "aof-learning-loop",
  "snapshot_format_version": 1,
  "organization_ref": ".aof/organization.json",
  "generated_at": "2026-06-15T06:34:24.218Z",
  "latest_outcome": {
    "source_session_id": "SESS-MQEU8H6L-LZ78VI",
    "report_id": "OUT-MQEU8H76-L0X13R",
    "result": "success",
    "observed_at": "2026-06-15T06:34:21.330Z",
    "note": "The backend-neutral runtime loop proof completed with auditable allocation, execution, review, and outcome artifacts.",
    "signal_ref": ".aof/artifacts/execution/council-reviews/CREV-MQEU8H75-01ZD4S.json"
  },
  "latest_self_audit": {
    "audit_id": "FSA-RUNTIME-LOOP-001",
    "recorded_at": "2026-06-15T06:34:21.331Z",
    "summary": "One end-to-end runtime proof loop completed and should now be tightened into a release-grade major version gate.",
    "detected_gap": "The proof is deterministic and local; broader backend-family evidence is still a release follow-up.",
    "result_state": null,
    "next_action": "Expand the same auditable loop shape across additional backend families without changing the contract layer.",
    "related_task_ids": [
      "TASK-011"
    ]
  },
  "current_next_value_slice": {
    "content": "Operationalize the review-validity and orchestrator runtime-discipline benchmark artifact sets before any new v3.x release tag.",
    "updated_at": "2026-06-15T06:34:21.331Z",
    "declared_complete_at": "2026-06-15T06:34:21.331Z",
    "source_session_id": "SESS-MQEU8H6L-LZ78VI",
    "source_decision_record_id": null
  },
  "improvement_proposal": {
    "proposal_basis": "framework-self-audit",
    "proposed_focus": "Expand the same auditable loop shape across additional backend families without changing the contract layer.",
    "related_task_ids": [
      "TASK-011"
    ],
    "open_task_count": 5
  },
  "learning_state": {
    "has_outcome_evidence": true,
    "has_self_audit": true,
    "has_next_value_slice": true,
    "loop_state": "improving"
  },
  "observations": [
    "Current next value slice: Operationalize the review-validity and orchestrator runtime-discipline benchmark artifact sets before any new v3.x release tag.",
    "Latest self-audit next action: Expand the same auditable loop shape across additional backend families without changing the contract layer.",
    "Latest outcome result: success"
  ]
}
